Estado;Cidade;Serventia;Tipo de Certidao;Forma de Entrega;Valor
Maranhão;Açailândia;1º OFÍCIO EXTRAJUDICIAL DE AÇAILÂNDIA;Certidão de Protesto;E-mail;100
Maranhão;Afonso Cunha;Serventia Extrajudicial de Afonso Cunha;Certidão de Protesto;E-mail;100
Maranhão;Alcântara;SERVENTIA EXTRAJUDICIAL DE ALCÂNTARA;Certidão de Protesto;E-mail;100
Maranhão;Aldeias Altas;SERVENTIA EXTRAJUDICIAL DE ALDEIAS ALTAS;Certidão de Protesto;E-mail;100
Maranhão;Altamira do Maranhão;OFÍCIO ÚNICO;Certidão de Protesto;E-mail;100
Maranhão;Alto Alegre do Maranhão;OFICIO ÚNICO DE ALTO ALEGRE DO MARANHÃO;Certidão de Protesto;E-mail;100
Maranhão;Alto Alegre do Pindaré;SERVENTIA EXTRAJUDICIAL DO OFÍCIO ÚNICO DE ALTO ALEGRE DO PINDARÉ;Certidão de Protesto;E-mail;100
Maranhão;Alto Parnaíba;1 Ofício Extrajudicial de Alto Parnaíba;Certidão de Protesto;E-mail;100
Maranhão;Amapá do Maranhão;SERVENTIA EXTRAJUDICIAL DE AMAPA DO MARANHÃO;Certidão de Protesto;E-mail;100
Maranhão;Amarante do Maranhão;SERVENTIA EXTRAJUDICIAL DO OFÍCIO ÚNICO DE AMARANTE DO MARANHÃO;Certidão de Protesto;E-mail;100
Maranhão;Anajatuba;SERVENTIA EXTRAJUDICIAL DA COMARCA DE ANAJATUBA;Certidão de Protesto;E-mail;100
Maranhão;Anapurus;SERVENTIA EXTRAJUDICIAL DO OFÍCIO ÚNICO DE ANAPURUS;Certidão de Protesto;E-mail;100
Maranhão;Apicum-Açu;Serventia Extrajudicial do Ofício Único de Apicum-Açu;Certidão de Protesto;E-mail;100
Maranhão;Araguanã;CARTORIO DO OFICIO UNICO DE ARAGUANA;Certidão de Protesto;E-mail;100
Maranhão;Araióses;SERVENTIA EXTRAJUDICIAL;Certidão de Protesto;E-mail;100
Maranhão;Arame;1 OFICIO DO REGISTRO CIVIL E TABELIONATO DE NOTAS, PROTESTOS E REGISTROS.;Certidão de Protesto;E-mail;100
Maranhão;Arari;SERVENTIA EXTRAJUDICIAL DO 1º OFÍCIO DE ARARI;Certidão de Protesto;E-mail;100
Maranhão;Axixá;AXIXÁ CARTÓRIO DO OFÍCIO ÚNICO;Certidão de Protesto;E-mail;100
Maranhão;Bacabal;NOTAS, REGISTROS DE IMÓVEIS E PROTESTOS DE LETRAS;Certidão de Protesto;E-mail;100
Maranhão;Bacabeira;SERVENTIA EXTRAJUDICIAL DE OFICIO UNICO;Certidão de Protesto;E-mail;100
Maranhão;Bacuri;CARTÓRIO DE BACURI;Certidão de Protesto;E-mail;100
Maranhão;Balsas;CARTÓRIO DO 1º OFÍCIO DE BALSAS;Certidão de Protesto;E-mail;100
Maranhão;Barão de Grajaú;1º Ofício Extrajudicial de Barão de Grajaú;Certidão de Protesto;E-mail;100
Maranhão;Barra do Corda;1º OFICIO DE BARRA DO CORDA;Certidão de Protesto;E-mail;100
Maranhão;Barreirinhas;SERVENTIA EXTRAJUDICIAL DE BARREIRINHAS;Certidão de Protesto;E-mail;100
Maranhão;Bela Vista do Maranhão;CARTORIO AFONSO PEDRO GONÇALVES DIAS;Certidão de Protesto;E-mail;100
Maranhão;Benedito Leite;TABELIONATO DO OFICIO UNICO DE BENEDITO LEITE;Certidão de Protesto;E-mail;100
Maranhão;Bequimão;SERVENTIA EXTRAJUDICIAL DE BEQUIMÃO;Certidão de Protesto;E-mail;100
Maranhão;Bernardo do Mearim;Serventia Extrajudicial de Ofício Único de Bernardo do Mearim;Certidão de Protesto;E-mail;100
Maranhão;Boa Vista do Gurupi;Serventia Extrajudicial de Boa Vista do Gurupi;Certidão de Protesto;E-mail;100
Maranhão;Bom Jardim;1º OFÍCIO;Certidão de Protesto;E-mail;100
Maranhão;Bom Jesus das Selvas;SERVENTIA EXTRAJUDICIAL DE BOM JESUS DAS SELVAS;Certidão de Protesto;E-mail;100
Maranhão;Bom Lugar;SERVENTIA EXTRAJUDICIAL BOM LUGAR;Certidão de Protesto;E-mail;100
Maranhão;Brejo;SERVENTIA EXTRAJUDICIAL DE BREJO;Certidão de Protesto;E-mail;100
Maranhão;Brejo de Areia;CARTORIO DO OFICIO UNICO;Certidão de Protesto;E-mail;100
Maranhão;Buriti;1º Ofício Extrajudicial de Buriti;Certidão de Protesto;E-mail;100
Maranhão;Buriti Bravo;SERVENTIA EXTRAJUDICIAL DE BURITI BRAVO;Certidão de Protesto;E-mail;100
Maranhão;Buriticupu;SERVENTIA EXTRAJUDICIAL DE BURITICUPU;Certidão de Protesto;E-mail;100
Maranhão;Buritirana;SERVENTIA EXTRAJUDICIAL DE BURITIRANA;Certidão de Protesto;E-mail;100
Maranhão;Cachoeira Grande;SERVENTIA EXTRAJUDICIAL DE CACHOEIRA GRANDE;Certidão de Protesto;E-mail;100
Maranhão;Cajapió;OFÍCIO ÚNICO;Certidão de Protesto;E-mail;100
Maranhão;Cajari;SERVENTIA EXTRAJUDICIAL DO OFÍCIO ÚNICO DE CAJARI;Certidão de Protesto;E-mail;100
Maranhão;Campestre do Maranhão;SERVENTIA EXTRAJUDICIAL DE CAMPESTRE DO MARANHÃO;Certidão de Protesto;E-mail;100
Maranhão;Cândido Mendes;SERVENTIA EXTRAJUDICIAL DE CÂNDIDO MENDES;Certidão de Protesto;E-mail;100
Maranhão;Cantanhede;CARTORIO DO OFICIO UNICO;Certidão de Protesto;E-mail;100
Maranhão;Capinzal do Norte;SERVENTIA EXTRAJUDICIAL DE OFICIO UNICO;Certidão de Protesto;E-mail;100
Maranhão;Carolina;1 OFICIO EXTRAJUDICIAL DE CAROLINA;Certidão de Protesto;E-mail;100
Maranhão;Carutapera;SERVENTIA EXTRAJUDICIAL DE CARUTAPERA;Certidão de Protesto;E-mail;100
Maranhão;Caxias;PROTESTO E NOTAS;Certidão de Protesto;E-mail;100
Maranhão;Cedral;Serventia Extrajudicial do Ofício Único de Cedral;Certidão de Protesto;E-mail;100
Maranhão;Centro do Guilherme;CARTÓRIO EXTRAJUDICIAL OFÍCIO ÚNICO DE CENTRO DO GUILHERME;Certidão de Protesto;E-mail;100
Maranhão;Centro Novo do Maranhão;SERVENTIA EXTRAJUDICIAL DE OFICIO UNICO;Certidão de Protesto;E-mail;100
Maranhão;Chapadinha;1º OFÍCIO EXTRAJUDICIAL DE CHAPADINHA;Certidão de Protesto;E-mail;100
Maranhão;Cidelândia;SERVENTIA EXTRAJUDICIAL DE OFICIO UNICO;Certidão de Protesto;E-mail;100
Maranhão;Codó;3º OFICIO EXTRAJUDICIAL;Certidão de Protesto;E-mail;100
Maranhão;Coelho Neto;PROTESTO DE TITULOS;Certidão de Protesto;E-mail;100
Maranhão;Colinas;1º OFÍCIO EXTRAJUDICIAL DE COLINAS;Certidão de Protesto;E-mail;100
Maranhão;Conceição do Lago-Açu;SERVENTIA EXTRAJUDICIAL DE CONCEIÇÃO DO LAGO AÇU;Certidão de Protesto;E-mail;100
Maranhão;Coroatá;CARTORIO 3 OFICIO DE COROATA;Certidão de Protesto;E-mail;100
Maranhão;Cururupu;CARTÓRIO DO 1º OFICIO EXTRAJUDICIAL DE CURURUPU (RESPONDENDO);Certidão de Protesto;E-mail;100
Maranhão;Davinópolis;SERVENTIA EXTRAJUDICIAL DO OFICIO UNICO DE DAVINOPOLIS;Certidão de Protesto;E-mail;100
Maranhão;Dom Pedro;CARTÓRIO DO 1º OFICIO EXTRA JUDICIAL;Certidão de Protesto;E-mail;100
Maranhão;Duque Bacelar;SERVENTIA EXTRAJUDICIAL DE DUQUE BACELAR;Certidão de Protesto;E-mail;100
Maranhão;Esperantinópolis;SERVENTIA EXTRAJUDICIAL DO OFICIO UNICO DE ESPERANTINOPOLIS;Certidão de Protesto;E-mail;100
Maranhão;Estreito;CARTÓRIO DO 1º OFÍCIO;Certidão de Protesto;E-mail;100
Maranhão;Feira Nova do Maranhão;OFICIO UNICO DE REGISTRO DE IMOVEIS E TABELIONATO DE NOTAS;Certidão de Protesto;E-mail;100
Maranhão;Fernando Falcão;SERVENTIA EXTRAJUDICIAL DO OFÍCIO ÚNICO DE FERNANDO FALCÃO;Certidão de Protesto;E-mail;100
Maranhão;Formosa da Serra Negra;FORMOSA DA S N CARTORIO OFICIO UNICO;Certidão de Protesto;E-mail;100
Maranhão;Fortaleza dos Nogueiras;OFICIO ÚNICO DE FORTALEZA DOS NOGUEIRAS;Certidão de Protesto;E-mail;100
Maranhão;Fortuna;CARTÓRIO DIOGO VIANA;Certidão de Protesto;E-mail;100
Maranhão;Godofredo Viana;SERVENTIA EXTRAJUDICIAL DE GODOFREDO VIANA;Certidão de Protesto;E-mail;100
Maranhão;Gonçalves Dias;CARTÓRIO DO OFÍCIO ÚNICO EXTRAJUDICIAL;Certidão de Protesto;E-mail;100
Maranhão;Governador Archer;CARTÓRIO OFÍCIO ÚNICO DE GOVERNADOR ARCHER;Certidão de Protesto;E-mail;100
Maranhão;Governador Edison Lobão;SERVENTIA EXTRAJUDICIAL OFÍCIO ÚNICO;Certidão de Protesto;E-mail;100
Maranhão;Governador Eugênio Barros;1º OFÍCIO;Certidão de Protesto;E-mail;100
Maranhão;Governador Luiz Rocha;OFICIO UNICO DE GOVERNADOR LUIZ ROCHA;Certidão de Protesto;E-mail;100
Maranhão;Governador Newton Bello;SERVENTIA EXTRAJUDICIAL DE GOVERNADOR NEWTON BELLO;Certidão de Protesto;E-mail;100
Maranhão;Governador Nunes Freire;Serventia Extrajudicial do Ofício Único de Governador Nunes Freire;Certidão de Protesto;E-mail;100
Maranhão;Graça Aranha;Ofício Único de Graça Aranha;Certidão de Protesto;E-mail;100
Maranhão;Grajaú;1 OFICIO EXTRAJUDICIAL DE GRAJAÚ;Certidão de Protesto;E-mail;100
Maranhão;Guimarães;SERVENTIA EXTRAJUDICIAL DE GUIMARÃES;Certidão de Protesto;E-mail;100
Maranhão;Humberto de Campos;SERVENTIA EXTRAJUDICIAL DO OFICIO UNICO DE HUMBERTO DE CAMPOS;Certidão de Protesto;E-mail;100
Maranhão;Icatu;CARTORIO DO OFICIO UNICO DE ICATU;Certidão de Protesto;E-mail;100
Maranhão;Igarapé do Meio;Serventia Extarjudicial de Igarapé do Meio;Certidão de Protesto;E-mail;100
Maranhão;Igarapé Grande;SERVENTIA EXTRAJUDICIAL DE IGARAPÉ GRANDE;Certidão de Protesto;E-mail;100
Maranhão;Imperatriz;3 OFICIO EXTRAJUDICIAL DA COMARCA DE IMPERATRIZ;Certidão de Protesto;E-mail;100
Maranhão;Imperatriz;4º Oficio de Imperatriz;Certidão de Protesto;E-mail;100
Maranhão;Imperatriz;5º OFÍCIO EXTRAJUDICIAL DE IMPERATRIZ;Certidão de Protesto;E-mail;100
Maranhão;Itaipava do Grajaú;SERVENTIA EXTRAJUDICIAL DO OFÍCIO ÚNICO DE ITAIPAVA DO GRAJAÚ;Certidão de Protesto;E-mail;100
Maranhão;Itapecuru-Mirim;Cartório do Terceiro Ofício de Itapecuru-Mirim;Certidão de Protesto;E-mail;100
Maranhão;Itinga do Maranhão;SERVENTIA EXTRAJUDICIAL DE ITINGA DO MARANHÃO;Certidão de Protesto;E-mail;100
Maranhão;Jatobá;SERVENTIA EXTRAJUDICIAL DE JATOBA;Certidão de Protesto;E-mail;100
Maranhão;Jenipapo dos Vieiras;Cartorio Jenipapo dos Vieiras;Certidão de Protesto;E-mail;100
Maranhão;João Lisboa;1º OFÍCIO EXTRAJUDICIAL DE JOÃO LISBOA;Certidão de Protesto;E-mail;100
Maranhão;Joselândia;Serventia Extrajudicial do Ofício Único de Joselândia;Certidão de Protesto;E-mail;100
Maranhão;Junco do Maranhão;Cartorio de Junco do Maranhão;Certidão de Protesto;E-mail;100
Maranhão;Lago da Pedra;CARTORIO DO 1 OFICIO;Certidão de Protesto;E-mail;100
Maranhão;Lago do Junco;SERVENTIA EXTRAJUDICIAL DE LAGO DO JUNCO;Certidão de Protesto;E-mail;100
Maranhão;Lago dos Rodrigues;OFÍCIO ÚNICO DE LAGO DOS RODRIGUES;Certidão de Protesto;E-mail;100
Maranhão;Lago Verde;OFÍCIO ÚNICO DE LAGO VERDE;Certidão de Protesto;E-mail;100
Maranhão;Lagoa do Mato;SERVENTIA EXTRAJUDICIAL DE OFÍCIO ÚNICO DE LAGOA DO MATO;Certidão de Protesto;E-mail;100
Maranhão;Lagoa Grande do Maranhão;OFÍCIO ÚNICO DE LAGOA GRANDE DO MARANHÃO;Certidão de Protesto;E-mail;100
Maranhão;Lajeado Novo;SERVENTIA EXTRAJUDICIAL DE LAJEADO NOVO;Certidão de Protesto;E-mail;100
Maranhão;Lima Campos;SERVENTIA EXTRAJUDICIAL DE OFÍCIO ÚNICO;Certidão de Protesto;E-mail;100
Maranhão;Loreto;SERVENTIA EXTRAJUDICIAL OFICIO ÚNICO DA COMARCA DE LORETO;Certidão de Protesto;E-mail;100
Maranhão;Magalhães de Almeida;SERVENTIA EXTRAJUDICIAL DE OFÍCIO ÚNICO;Certidão de Protesto;E-mail;100
Maranhão;Maracaçumé;CARTÓRIO ÚNICO DE MARACAÇUMÉ;Certidão de Protesto;E-mail;100
Maranhão;Marajá do Sena;Serventia Extrajudicial Única de Marajá do Sena;Certidão de Protesto;E-mail;100
Maranhão;Maranhãozinho;SERVENTIA EXTRAJUDICIAL;Certidão de Protesto;E-mail;100
Maranhão;Mata Roma;OFICIO UNICO DE MATA ROMA;Certidão de Protesto;E-mail;100
Maranhão;Matinha;MATINHA CARTORIO DO OFICIO UNICO;Certidão de Protesto;E-mail;100
Maranhão;Matões;SERVENTIA EXTRA JUDICIAL DE MATOES CARTORIO UNICO;Certidão de Protesto;E-mail;100
Maranhão;Matões do Norte;SERVENTIA EXTRAJUDICIAL DE OFÍCIO ÚNICO;Certidão de Protesto;E-mail;100
Maranhão;Milagres do Maranhão;SERVENTIA EXTRAJUDICIAL DO OFÍCIO ÚNICO DE MILAGRES DO MARANHÃO;Certidão de Protesto;E-mail;100
Maranhão;Mirador;Serventia Extrajudicial de Mirador;Certidão de Protesto;E-mail;100
Maranhão;Miranda do Norte;OFÍCIO ÚNICO DE MIRANDA DO NORTE;Certidão de Protesto;E-mail;100
Maranhão;Mirinzal;SERVENTIA EXTRAJUDICIAL DE MIRINZAL;Certidão de Protesto;E-mail;100
Maranhão;Monção;SERVENTIA EXTRAJUDICIAL DO OFICIO ÚNICO DE MONÇÃO;Certidão de Protesto;E-mail;100
Maranhão;Montes Altos;SERVENTIA EXTRAJUDICIAL DE OFÍCIO ÚNICO;Certidão de Protesto;E-mail;100
Maranhão;Morros;OFICIO ÚNICO DE MORROS;Certidão de Protesto;E-mail;100
Maranhão;Nina Rodrigues;SERVENTIA EXTRAJUDICIAL OFÍCIO ÚNICO DE NINA RODRIGUES;Certidão de Protesto;E-mail;100
Maranhão;Nova Colinas;SERVENTIA EXTRAJUDICIAL DE NOVA COLINAS;Certidão de Protesto;E-mail;100
Maranhão;Nova Iorque;SERVENTIA EXTRAJUDICIAL DO OFICIO ÚNICO DE NOVA IORQUE;Certidão de Protesto;E-mail;100
Maranhão;Nova Olinda do Maranhão;SERVENTIA EXTRAJUDICIAL DO OFICIO ÚNICO DE NOVA OLINDA;Certidão de Protesto;E-mail;100
Maranhão;Olho d'Água das Cunhãs;SERVENTIA EXTRAJUDICIAL;Certidão de Protesto;E-mail;100
Maranhão;Olinda Nova do Maranhão;OFICIO UNICO DE OLINDA NOVA DO MARANHÃO;Certidão de Protesto;E-mail;100
Maranhão;Paço do Lumiar;1 OFICIO DE REGISTRO DE IMOVEIS E TABELIONATO DE NOTAS E PROTESTO;Certidão de Protesto;E-mail;100
Maranhão;Palmeirândia;SERVENTIA EXTRAJUDICIAL DE OFÍCIO ÚNICO;Certidão de Protesto;E-mail;100
Maranhão;Paraibano;1 OFICIO DE NOTAS, REGISTRO DE IMOVEIS E PROTESTOS;Certidão de Protesto;E-mail;100
Maranhão;Parnarama;SERVENTIA EXTRAJUDICIAL DO OFÍCIO ÚNICO DE PARNARAMA;Certidão de Protesto;E-mail;100
Maranhão;Passagem Franca;SERVENTIA EXTRAJUDICIAL DA COMARCA DE PASSAGEM FRANCA;Certidão de Protesto;E-mail;100
Maranhão;Pastos Bons;1º OFÍCIO EXTRAJUDICIAL DE PASTOS BONS;Certidão de Protesto;E-mail;100
Maranhão;Paulino Neves;Serventia Extrajudicial de Paulino Neves;Certidão de Protesto;E-mail;100
Maranhão;Paulo Ramos;SERVENTIA EXTRAJUDICIAL ÚNICA;Certidão de Protesto;E-mail;100
Maranhão;Pedreiras;SERVENTIA EXTRAJUDICIAL DO 3º OFICIO DE PEDREIRAS;Certidão de Protesto;E-mail;100
Maranhão;Pedro do Rosário;CARTÓRIO DE OFÍCIO ÚNICO DE PEDRO DO ROSÁRIO;Certidão de Protesto;E-mail;100
Maranhão;Penalva;SERVENTIA EXTRAJUDICIAL DO OFÍCIO ÚNICO DE PENALVA;Certidão de Protesto;E-mail;100
Maranhão;Peri Mirim;SERVENTIA EXTRAJUDICIAL DE OFÍCIO ÚNICO;Certidão de Protesto;E-mail;100
Maranhão;Peritoró;CARTÓRIO DO OFÍCIO ÚNICO DE PERITORÓ;Certidão de Protesto;E-mail;100
Maranhão;Pindaré-Mirim;1º OFÍCIO DE REGISTRO DE IMÓVEIS E ANEXOS;Certidão de Protesto;E-mail;100
Maranhão;Pinheiro;1 OFICIO EXTRAJUDIAL DE PINHEIRO;Certidão de Protesto;E-mail;100
Maranhão;Pio XII;SERVENTIA EXTRAJUDICIAL DE PIO XII;Certidão de Protesto;E-mail;100
Maranhão;Pirapemas;CARTORIO OFICIO UNICO;Certidão de Protesto;E-mail;100
Maranhão;Poção de Pedras;CARTORIO OFICIO UNICO DE POCAO DE PEDRAS;Certidão de Protesto;E-mail;100
Maranhão;Porto Franco;CARTÓRIO DO 1 OFÍCIO EXTRAJUDICIAL;Certidão de Protesto;E-mail;100
Maranhão;Presidente Dutra;1 OFICIO EXTRAJUDICIAL DE PRESIDENTE DUTRA;Certidão de Protesto;E-mail;100
Maranhão;Presidente Juscelino;SERVENTIA EXTRAJUDICIAL DE PRESIDENTE JUSCELINO;Certidão de Protesto;E-mail;100
Maranhão;Presidente Médici;SERVENTIA EXTRAJUDICIAL DO OFÍCIO ÚNICO DE PRESIDENTE MÉDICI;Certidão de Protesto;E-mail;100
Maranhão;Presidente Sarney;SERVENTIA EXTRAJUDICIAL DE PRESIDENTE SARNEY;Certidão de Protesto;E-mail;100
Maranhão;Presidente Vargas;CARTORIO DO OFICIO UNICO;Certidão de Protesto;E-mail;100
Maranhão;Primeira Cruz;UNICO DE PRIMEIRA CRUZ;Certidão de Protesto;E-mail;100
Maranhão;Raposa;SERVENTIA EXTRAJUDICIAL DO OFÍCIO ÚNICO DE RAPOSA;Certidão de Protesto;E-mail;100
Maranhão;Riachão;CARTORIO 2º OFICIO;Certidão de Protesto;E-mail;100
Maranhão;Ribamar Fiquene;SERVENTIA EXTRAJUDICIAL DO OFÍCIO ÚNICO DE RIBAMAR FIQUENE;Certidão de Protesto;E-mail;100
Maranhão;Rosário;CARTÓRIO DO 1º OFICIO EXTRAJUDICIAL;Certidão de Protesto;E-mail;100
Maranhão;Sambaíba;SERVENTIA EXTRAJUDICIAL DO OFÍCIO ÚNICO DE SAMBAÍBA;Certidão de Protesto;E-mail;100
Maranhão;Santa Filomena do Maranhão;Serventia Extrajudicial de Oficio Único de Santa Filomena do Maranhão;Certidão de Protesto;E-mail;100
Maranhão;Santa Helena;Cartório do 1º Oficio Extrajudicial;Certidão de Protesto;E-mail;100
Maranhão;Santa Inês;3º OFÍCIO EXTRAJUDICIAL SANTA INES;Certidão de Protesto;E-mail;100
Maranhão;Santa Luzia;CATORIO DO 1º. OFICIO EXTRAJUDICIAL;Certidão de Protesto;E-mail;100
Maranhão;Santa Luzia do Paruá;OFÍCIO EXTRAJUDICIAL DE SANTA LUZIA DO PARUÁ;Certidão de Protesto;E-mail;100
Maranhão;Santa Quitéria do Maranhão;SERVENTIA EXTRAJUDICIAL DO OFÍCIO ÚNICO;Certidão de Protesto;E-mail;100
Maranhão;Santa Rita;SERVENTIA EXTRAJUDICIAL DE SANTA RITA;Certidão de Protesto;E-mail;100
Maranhão;Santana do Maranhão;CARTÓRIO ÚNICO DE SANTANA DO MARANHÃO;Certidão de Protesto;E-mail;100
Maranhão;Santo Amaro do Maranhão;SERVENTIA EXTRAJUDICIAL DO OFÍCIO ÚNICO;Certidão de Protesto;E-mail;100
Maranhão;Santo Antônio dos Lopes;SERVENTIA EXTRAJUDICIAL DE SANTO ANTONIO DOS LOPES;Certidão de Protesto;E-mail;100
Maranhão;São Benedito do Rio Preto;SERVENTIA EXTRAJUDICIAL DO OFÍCIO ÚNICO DE SÃO BENEDITO DO RIO PRETO;Certidão de Protesto;E-mail;100
Maranhão;São Bento;CARTORIO DO 1 OFICIO EXTRAJUDICIAL DE SAO BENTO;Certidão de Protesto;E-mail;100
Maranhão;São Bernardo;SERVENTIA EXTRAJUDICIAL DE OFICIO UNICO;Certidão de Protesto;E-mail;100
Maranhão;São Domingos do Azeitão;SERVENTIA EXTRAJUDICIAL DE SAO DOMINGOS DO AZEITAO;Certidão de Protesto;E-mail;100
Maranhão;São Domingos do Maranhão;SERVENTIA EXTRAJUDICIAL DE SÃO DOMINGOS DO MARANHÃO;Certidão de Protesto;E-mail;100
Maranhão;São Félix de Balsas;Serventia Extrajudicial do Ofício Único de São Félix de Balsas;Certidão de Protesto;E-mail;100
Maranhão;São Francisco do Brejão;SERVENTIA EXTRAJUDICIAL DE SÃO FRANCISCO DO BREJÃO;Certidão de Protesto;E-mail;100
Maranhão;São Francisco do Maranhão;Serventia Extrajudicial do Ofício Único de São Francisco do Maranhão;Certidão de Protesto;E-mail;100
Maranhão;São João Batista;SERVENTIA EXTRAJUDICIAL DE SAO JOAO BATISTA;Certidão de Protesto;E-mail;100
Maranhão;São João do Carú;SERVENTIA EXTRAJUDICIAL DE SAO JOAO DO CARU;Certidão de Protesto;E-mail;100
Maranhão;São João do Paraíso;SERVENTIA EXTRAJUDICIAL DE SÃO JOÃO DO PARAÍSO;Certidão de Protesto;E-mail;100
Maranhão;São João do Soter;CARTÓRIO DE SÃO JOÃO DO SOTER;Certidão de Protesto;E-mail;100
Maranhão;São João dos Patos;OFÍCIO ÚNICO DA COMARCA DE SÃO JOÃO DOS PATOS;Certidão de Protesto;E-mail;100
Maranhão;São José de Ribamar;1º OFÍCIO DE REGISTRO DE IMOVEIS E TABELIONATO DE NOTAS E PROTESTOS DE SAO JOSE DE RIBAMAR;Certidão de Protesto;E-mail;100
Maranhão;São José dos Basílios;CARTORIO SÃO JOSÉ DOS BASÍLIOS;Certidão de Protesto;E-mail;100
Maranhão;São Luís;1 TABELIONATO DE PROTESTO DE LETRAS E OUTROS TITULOS DE CREDITOS;Certidão de Protesto;E-mail;100
Maranhão;São Luís;2 TABELIONATO DE PROTESTO DE LETRAS E OUTROS TITULOS DE CREDITOS;Certidão de Protesto;E-mail;100
Maranhão;São Luís Gonzaga do Maranhão;1º OFÍCIO;Certidão de Protesto;E-mail;100
Maranhão;São Mateus do Maranhão;OFICIO UNICO DE SAO MATEUS DO MARANHAO;Certidão de Protesto;E-mail;100
Maranhão;São Pedro da Água Branca;CARTÓRIO OFICIO ÚNICO DE SÃO PEDRO DA ÁGUA BRANCA;Certidão de Protesto;E-mail;100
Maranhão;São Pedro dos Crentes;SERVENTIA EXTRAJUDICIAL DE OFÍCIO ÚNICO DE SÃO PEDRO DOS CRENTES;Certidão de Protesto;E-mail;100
Maranhão;São Raimundo das Mangabeiras;SERVENTIA EXTRAJUDICIAL DE SAO RAIMUNDO DAS MANGABEIRAS;Certidão de Protesto;E-mail;100
Maranhão;São Vicente Ferrer;SERVENTIA EXTRAJUDICIAL DE SÃO VICENTE FERRER;Certidão de Protesto;E-mail;100
Maranhão;Satubinha;SERVENTIA EXTRAJUDICIAL DE OFÍCIO ÚNICO;Certidão de Protesto;E-mail;100
Maranhão;Senador Alexandre Costa;SERVENTIA EXTRAJUDICIAL DE SENADOR ALEXANDRE COSTA;Certidão de Protesto;E-mail;100
Maranhão;Senador La Rocque;SERVENTIA EXTRAJUDICIAL DE SENADOR LA ROCQUE;Certidão de Protesto;E-mail;100
Maranhão;Sítio Novo;SERVENTIA EXTRAJUDICIAL DE SITIO NOVO;Certidão de Protesto;E-mail;100
Maranhão;Sucupira do Norte;SERVENTIA EXTRAJUDICIAL DE SUCUPIRA DO NORTE;Certidão de Protesto;E-mail;100
Maranhão;Sucupira do Riachão;cartório de ofício único de Sucupira do Riachão;Certidão de Protesto;E-mail;100
Maranhão;Tasso Fragoso;SERVENTIA NOTARIAL E REGISTRAL DE TASSO FRAGOSO;Certidão de Protesto;E-mail;100
Maranhão;Timbiras;SERVENTIA EXTRAJUDICIAL DE TIMBIRAS;Certidão de Protesto;E-mail;100
Maranhão;Timon;3 OFICIO EXTRAJUDICIAL DE TIMON;Certidão de Protesto;E-mail;100
Maranhão;Trizidela do Vale;CARTÓRIO DE OFÍCIO ÚNICO DE TRIZIDELA DO VALE;Certidão de Protesto;E-mail;100
Maranhão;Tufilândia;Cartório Extrajudicial;Certidão de Protesto;E-mail;100
Maranhão;Tuntum;1º Ofício Extrajudicial de Tuntum;Certidão de Protesto;E-mail;100
Maranhão;Turiaçu;SERVENTIA EXTRAJUDICIAL DO OFÍCIO ÚNICO DE TURIAÇU;Certidão de Protesto;E-mail;100
Maranhão;Turilândia;SERVENTIA EXTRAJUDICIAL DE TURILÂNDIA;Certidão de Protesto;E-mail;100
Maranhão;Tutoia;CARTORIO OFÍCIO ÚNICO DE TUTÓIA;Certidão de Protesto;E-mail;100
Maranhão;Urbano Santos;SERVENTIA EXTRAJUDICIAL DE OFÍCIO ÚNICO;Certidão de Protesto;E-mail;100
Maranhão;Vargem Grande;CARTORIO 1º OFICIO;Certidão de Protesto;E-mail;100
Maranhão;Viana;VIANA CARTÓRIO DO 1º OFÍCIO;Certidão de Protesto;E-mail;100
Maranhão;Vila Nova dos Martírios;SERVENTIA EXTRAJUDICIAL DE VILA NOVA DOS MARTIRIOS;Certidão de Protesto;E-mail;100
Maranhão;Vitória do Mearim;SERVENTIA EXTRAJUDICIAL DE VITÓRIA DO MEARIM;Certidão de Protesto;E-mail;100
Maranhão;Vitorino Freire;1º OFÍCIO EXTRAJUDICIAL DE VITORINO FREIRE;Certidão de Protesto;E-mail;100
Maranhão;Zé Doca;1º OFÍCIO EXTRAJUDICIAL DE ZÉ DOCA;Certidão de Protesto;E-mail;100